{
  "schema_version": "1.0.0",
  "document_id": "doc_demo_hr_002",
  "candidate_id": "demo_hr_002",
  "parse_metadata": {"source_type": "mock_fixture", "parsed_at": "2026-05-26T00:00:00Z", "parser_version": "stage3_v1", "redacted_text_path": null, "source_filename": "demo_hr_002_redacted.txt"},
  "sensitive_information": {"name_detected": true, "gender": null, "birth_year": null, "marital_status": null, "salary_current": null, "salary_expected": null, "location": "[地域信息已脱敏]", "masked_for_scoring": true},
  "candidate_profile": {"display_id": "CAND-HR-002", "target_domains": ["hr"], "target_domain_candidates": [{"domain": "hr", "confidence": 0.82, "evidence_ids": ["ev_hr2_job2", "ev_hr2_ach1"]}], "summary": "脱敏候选人偏招聘交付与培训运营，组织设计证据较少。", "highest_degree": "本科", "major": "工商管理", "total_years_experience": 6, "current_level": "招聘经理"},
  "education_records": [{"school": "脱敏大学B", "degree": "本科", "major": "工商管理", "start_date": "2013-09", "end_date": "2017-06", "evidence_id": "ev_hr2_edu"}],
  "career_records": [
    {"company": "脱敏服务组织C", "title": "招聘专员", "start_date": "2017-07", "end_date": "2020-06", "description": "执行一线岗位招聘、面试邀约和渠道维护。", "domain_tags": ["hr"], "management_headcount": 0, "platform_evidence": ["区域团队"], "evidence_ids": ["ev_hr2_job1"], "evidence_id": "ev_hr2_job1"},
    {"company": "脱敏制造组织D", "title": "招聘经理", "start_date": "2020-07", "end_date": "2025-12", "description": "负责招聘配置、培训协同和入职流程改善。", "domain_tags": ["hr"], "management_headcount": 4, "platform_evidence": ["多工厂招聘"], "evidence_ids": ["ev_hr2_job2"], "evidence_id": "ev_hr2_job2"}
  ],
  "project_records": [{"project_name": "蓝领招聘渠道优化", "start_date": "2021-04", "end_date": "2021-10", "description": "梳理招聘渠道转化数据并优化入职流程。", "domain_tags": ["hr"], "evidence_ids": ["ev_hr2_project"], "evidence_id": "ev_hr2_project"}],
  "achievement_events": [
    {"achievement_id": "ach_hr2_001", "event_type": "recruitment_delivery", "metric_name": "半年招聘交付人数", "metric_value": 38, "metric_value_upper": null, "unit": "人", "direction": "increase", "period_months": 6, "approximate": false, "lower_bound": false, "candidate_contribution": "负责渠道筛选和面试流程推动", "evidence_grade": "B", "evidence_id": "ev_hr2_ach1"},
    {"achievement_id": "ach_hr2_002", "event_type": "organization_transformation", "metric_name": "入职流程优化", "metric_value": null, "metric_value_upper": null, "unit": null, "direction": "other", "period_months": null, "approximate": true, "lower_bound": false, "candidate_contribution": "参与流程梳理", "evidence_grade": "C", "evidence_id": "ev_hr2_ach2"}
  ],
  "domain_assessment_inputs": {"hr": {"domain": "hr", "matched_tags": ["招聘配置", "招聘完成率"], "competency_tags": ["招聘配置", "关键岗位招聘", "培训体系", "HRBP 业务支持"], "collaboration_tags": ["跨部门协同", "组织推动"], "evidence_ids": ["ev_hr2_job1", "ev_hr2_job2", "ev_hr2_project", "ev_hr2_ach1"], "notes": "招聘证据较强，组织发展较弱。"}},
  "evidence_items": [
    {"evidence_id": "ev_hr2_edu", "section": "教育经历", "quote": "本科，工商管理专业。", "fact_type": "education", "used_for_scoring": true},
    {"evidence_id": "ev_hr2_job1", "section": "工作经历", "quote": "执行一线岗位招聘、面试邀约和渠道维护。", "fact_type": "career", "used_for_scoring": true},
    {"evidence_id": "ev_hr2_job2", "section": "工作经历", "quote": "负责招聘配置、培训协同和入职流程改善。", "fact_type": "career", "used_for_scoring": true},
    {"evidence_id": "ev_hr2_project", "section": "项目经历", "quote": "梳理招聘渠道转化数据并优化入职流程。", "fact_type": "project", "used_for_scoring": true},
    {"evidence_id": "ev_hr2_ach1", "section": "工作业绩", "quote": "半年招聘交付38人。", "fact_type": "achievement", "used_for_scoring": true},
    {"evidence_id": "ev_hr2_ach2", "section": "工作业绩", "quote": "参与入职流程优化。", "fact_type": "achievement", "used_for_scoring": false}
  ],
  "quality_flags": [{"flag_type": "missing_quantified_scope", "severity": "warning", "description": "部分流程改善缺少量化范围。", "related_evidence_ids": ["ev_hr2_ach2"]}],
  "llm_metadata": {"provider": "mock", "model_name": "mock_fixture_v1", "temperature": 0, "extracted_at": "2026-05-26T00:00:00Z"}
}
